id,year,date,session_start,session_end,room,chair,session_title,duration,dtstart,dtend,location,author,type,title,topic
72,2023,Tue 16 May 2023,11:50,12:35,Meeting Room 109,Chair(s): Patanamon Thongtanunam The University of Melbourne,Development Tools & Practices II,12.0,2023-05-16T12:20:00,2023-05-16T12:32:00,Meeting Room 109,"Chao Ni, xiaodanxu , Kaiwen Yang, David Lo",Talk,Boosting Just-in-Time Defect Prediction with Specific Features of C Programming Languages in Code Changes,Technical Papers
73,2023,Tue 16 May 2023,11:50,12:35,Meeting Room 110,Chair(s): Patanamon Thongtanunam The University of Melbourne,Software Libraries & Ecosystems,12.0,2023-05-16T11:50:00,2023-05-16T12:02:00,Meeting Room 110,"Donald Pinckney, Federico Cassano, Arjun Guha, Jonathan Bell,  Pre-print",Talk,A Large Scale Analysis of Semantic Versioning in NPM,Technical Papers
74,2023,Tue 16 May 2023,11:50,12:35,Meeting Room 110,Chair(s): Patanamon Thongtanunam The University of Melbourne,Software Libraries & Ecosystems,12.0,2023-05-16T12:02:00,2023-05-16T12:14:00,Meeting Room 110,"Akira Mori, Masatomo Hashimoto",Talk,Phylogenetic Analysis of Reticulate Software Evolution,Technical Papers
75,2023,Tue 16 May 2023,11:50,12:35,Meeting Room 110,Chair(s): Patanamon Thongtanunam The University of Melbourne,Software Libraries & Ecosystems,6.0,2023-05-16T12:14:00,2023-05-16T12:20:00,Meeting Room 110,"Mohayeminul Islam, Ajay Jha, Sarah Nadi, Ildar Akhmetov",Talk,PyMigBench: A Benchmark for Python Library Migration,Data and Tool Showcase Track
76,2023,Tue 16 May 2023,11:50,12:35,Meeting Room 110,Chair(s): Patanamon Thongtanunam The University of Melbourne,Software Libraries & Ecosystems,6.0,2023-05-16T12:20:00,2023-05-16T12:26:00,Meeting Room 110,Sophia Vargas,Talk,Determining Open Source Project Boundaries,Industry Track
77,2023,Tue 16 May 2023,11:50,12:35,Meeting Room 110,Chair(s): Patanamon Thongtanunam The University of Melbourne,Software Libraries & Ecosystems,6.0,2023-05-16T12:26:00,2023-05-16T12:32:00,Meeting Room 110,"Kanchanok Kannee, Raula Gaikovina Kula, Supatsara Wattanakriengkrai, Kenichi Matsumoto,  Pre-print",Talk,Intertwining Communities: Exploring Libraries that Cross Software Ecosystems,Technical Papers
78,2023,Tue 16 May 2023,13:45,14:30,Meeting Room 109,Chair(s): Patanamon Thongtanunam The University of Melbourne,Tutorial #3,45.0,2023-05-16T13:45:00,2023-05-16T14:30:00,Meeting Room 109,"Tim Menzies,  Pre-print",Tutorial,Tutorial: Beyond the leading edge. What else is out there?,Tutorials
79,2023,Tue 16 May 2023,13:45,14:30,Meeting Room 110,Chair(s): Patanamon Thongtanunam The University of Melbourne,Software Quality,12.0,2023-05-16T13:45:00,2023-05-16T13:57:00,Meeting Room 110,"Ahmed Zerouali, Ruben Opdebeeck, Coen De Roover,  Pre-print",Talk,"Helm Charts for Kubernetes Applications: Evolution, Outdatedness and Security Risks",Technical Papers
80,2023,Tue 16 May 2023,13:45,14:30,Meeting Room 110,Chair(s): Patanamon Thongtanunam The University of Melbourne,Software Quality,12.0,2023-05-16T13:57:00,2023-05-16T14:09:00,Meeting Room 110,"Ruben Opdebeeck, Ahmed Zerouali, Coen De Roover,  Pre-print",Talk,Control and Data Flow in Security Smell Detection for Infrastructure as Code: Is It Worth the Effort?,Technical Papers
81,2023,Tue 16 May 2023,13:45,14:30,Meeting Room 110,Chair(s): Patanamon Thongtanunam The University of Melbourne,Software Quality,12.0,2023-05-16T14:09:00,2023-05-16T14:21:00,Meeting Room 110,"Ali Keshk, Robert Dyer,  Pre-print,  Media Attached",Talk,"Method Chaining Redux: An Empirical Study of Method Chaining in Java, Kotlin, and Python",Technical Papers
82,2023,Tue 16 May 2023,13:45,14:30,Meeting Room 110,Chair(s): Patanamon Thongtanunam The University of Melbourne,Software Quality,6.0,2023-05-16T14:21:00,2023-05-16T14:27:00,Meeting Room 110,"Emily Bui, Henrique Rocha",Talk,Snapshot Testing Dataset,Data and Tool Showcase Track
83,2023,Tue 16 May 2023,14:35,15:15,Meeting Room 109,Chair(s): Patanamon Thongtanunam The University of Melbourne,Defect Prediction,12.0,2023-05-16T14:35:00,2023-05-16T14:47:00,Meeting Room 109,"Kevin Jesse, Toufique Ahmed, Prem Devanbu, Emily Morgan,  Pre-print",Talk,"Large Language Models and Simple, Stupid Bugs",Technical Papers
84,2023,Tue 16 May 2023,14:35,15:15,Meeting Room 109,Chair(s): Patanamon Thongtanunam The University of Melbourne,Defect Prediction,12.0,2023-05-16T14:47:00,2023-05-16T14:59:00,Meeting Room 109,"Feifei Niu, Christoph Mayr-Dorn, Wesley Assunção, Liguo Huang, Jidong Ge, Bin Luo, Alexander Egyed,  Pre-print,  File Attached",Talk,The ABLoTS Approach for Bug Localization: is it replicable and generalizable?Distinguished Paper Award,Technical Papers
85,2023,Tue 16 May 2023,14:35,15:15,Meeting Room 109,Chair(s): Patanamon Thongtanunam The University of Melbourne,Defect Prediction,6.0,2023-05-16T14:59:00,2023-05-16T15:05:00,Meeting Room 109,"Catherine Tony, Markus Mutas, Nicolás E. Díaz Ferreyra, Riccardo Scandariato,  Pre-print",Talk,LLMSecEval: A Dataset of Natural Language Prompts for Security Evaluations,Data and Tool Showcase Track
86,2023,Tue 16 May 2023,14:35,15:15,Meeting Room 109,Chair(s): Patanamon Thongtanunam The University of Melbourne,Defect Prediction,6.0,2023-05-16T15:05:00,2023-05-16T15:11:00,Meeting Room 109,"Parvez Mahbub, Ohiduzzaman Shuvo, Masud Rahman,  Pre-print",Talk,"Defectors: A Large, Diverse Python Dataset for Defect Prediction",Data and Tool Showcase Track
87,2023,Tue 16 May 2023,14:35,15:15,Meeting Room 110,Chair(s): Patanamon Thongtanunam The University of Melbourne,Human Aspects,12.0,2023-05-16T14:35:00,2023-05-16T14:47:00,Meeting Room 110,"Mojtaba Shahin, Mansooreh Zahedi, Hourieh Khalajzadeh, Ali Rezaei Nasab,  Pre-print",Talk,A Study of Gender Discussions in Mobile Apps,Technical Papers
88,2023,Tue 16 May 2023,14:35,15:15,Meeting Room 110,Chair(s): Patanamon Thongtanunam The University of Melbourne,Human Aspects,12.0,2023-05-16T14:47:00,2023-05-16T14:59:00,Meeting Room 110,"Fabio Marcos De Abreu Santos, Jacob Penney, João Felipe Pimentel, Igor Wiese, Igor Steinmacher, Marco Gerosa,  Pre-print",Talk,Tell Me Who Are You Talking to and I Will Tell You What Issues Need Your Skills,Technical Papers
89,2023,Tue 16 May 2023,14:35,15:15,Meeting Room 110,Chair(s): Patanamon Thongtanunam The University of Melbourne,Human Aspects,6.0,2023-05-16T14:59:00,2023-05-16T15:05:00,Meeting Room 110,"Christoph Treude, Hideaki Hata,  Pre-print,  Media Attached",Talk,She Elicits Requirements and He Tests: Software Engineering Gender Bias in Large Language Models,Technical Papers
90,2023,Tue 16 May 2023,14:35,15:15,Meeting Room 110,Chair(s): Patanamon Thongtanunam The University of Melbourne,Human Aspects,6.0,2023-05-16T15:05:00,2023-05-16T15:11:00,Meeting Room 110,"Yibo Yan, Seth Frey, Amy Zhang, Vladimir Filkov, Likang Yin,  Pre-print",Talk,GitHub OSS Governance File Dataset,Data and Tool Showcase Track
91,2023,Tue 16 May 2023,15:45,17:30,Meeting Room 109,Chair(s): Patanamon Thongtanunam The University of Melbourne,Closing Session,20.0,2023-05-16T15:45:00,2023-05-16T16:05:00,Meeting Room 109,Eman Abdullah AlOmar,Talk,MSR 2023 Doctoral Research Award,MSR Awards
92,2023,Tue 16 May 2023,15:45,17:30,Meeting Room 109,Chair(s): Patanamon Thongtanunam The University of Melbourne,Closing Session,30.0,2023-05-16T16:05:00,2023-05-16T16:35:00,Meeting Room 109,Minghui Zhou,Talk,Open Source Software Digital Sociology: Quantifying and Understanding Large Complex Open Source Ecosystems,Vision and Reflection
93,2023,Tue 16 May 2023,15:45,17:30,Meeting Room 109,Chair(s): Patanamon Thongtanunam The University of Melbourne,Closing Session,30.0,2023-05-16T16:35:00,2023-05-16T17:05:00,Meeting Room 109,David Lo,Talk,Human-Centered AI for SE: Reflection and Vision,Vision and Reflection
94,2023,Tue 16 May 2023,15:45,17:30,Meeting Room 109,Chair(s): Patanamon Thongtanunam The University of Melbourne,Closing Session,25.0,2023-05-16T17:05:00,2023-05-16T17:30:00,Meeting Room 109,Emad Shihab,Day closing,Closing,MSR Awards
