id,year,date,session_start,session_end,room,chair,session_title,duration,dtstart,dtend,location,author,type,title,topic
1,2023,Mon 15 May 2023,09:00,10:30,Meeting Room 109,Chair(s): Patanamon Thongtanunam The University of Melbourne,Opening Session & Award Talks,20.0,2023-05-15T09:00:00,2023-05-15T09:20:00,Meeting Room 109,"Emad Shihab, Patanamon Thongtanunam, Bogdan Vasilescu",Day opening,Opening Session & Award Announcements,MSR Awards
2,2023,Mon 15 May 2023,09:00,10:30,Meeting Room 109,Chair(s): Patanamon Thongtanunam The University of Melbourne,Opening Session & Award Talks,20.0,2023-05-15T09:20:00,2023-05-15T09:40:00,Meeting Room 109,Audris Mockus,Talk,MSR 2023 Foundational Contribution Award,MSR Awards
3,2023,Mon 15 May 2023,09:00,10:30,Meeting Room 109,Chair(s): Patanamon Thongtanunam The University of Melbourne,Opening Session & Award Talks,20.0,2023-05-15T09:40:00,2023-05-15T10:00:00,Meeting Room 109,Li Li,Talk,MSR 2023 Ric Holt Early Career Achievement Award,MSR Awards
4,2023,Mon 15 May 2023,09:00,10:30,Meeting Room 109,Chair(s): Patanamon Thongtanunam The University of Melbourne,Opening Session & Award Talks,30.0,2023-05-15T10:00:00,2023-05-15T10:30:00,Meeting Room 109,"Miltiadis Allamanis, Charles Sutton",Talk,MIP #1: Mining Source Code Repositories at Massive Scale Using Language Modeling,MIP Award
5,2023,Mon 15 May 2023,11:00,11:45,Meeting Room 109,Chair(s): Patanamon Thongtanunam The University of Melbourne,Development Tools & Practices I,12.0,2023-05-15T11:00:00,2023-05-15T11:12:00,Meeting Room 109,"Kazi Amit Hasan, Marcos Macedo, Yuan Tian, Bram Adams, Ding Steven, H., H.,  Pre-print",Talk,Understanding the Time to First Response In GitHub Pull Requests,Technical Papers
6,2023,Mon 15 May 2023,11:00,11:45,Meeting Room 109,Chair(s): Patanamon Thongtanunam The University of Melbourne,Development Tools & Practices I,12.0,2023-05-15T11:12:00,2023-05-15T11:24:00,Meeting Room 109,"Phuong T. Nguyen, Riccardo Rubei, Juri Di Rocco, Claudio Di Sipio, Davide Di Ruscio, Massimiliano Di Penta,  Pre-print",Talk,Dealing with Popularity Bias in Recommender Systems for Third-party Libraries: How far Are We?,Technical Papers
7,2023,Mon 15 May 2023,11:00,11:45,Meeting Room 109,Chair(s): Patanamon Thongtanunam The University of Melbourne,Development Tools & Practices I,6.0,2023-05-15T11:24:00,2023-05-15T11:30:00,Meeting Room 109,"Ilham Qasse, Mohammad Hamdaqa, Björn Þór Jónsson",Talk,Smart Contract Upgradeability on the Ethereum Blockchain Platform: An Exploratory Study,Registered Reports
8,2023,Mon 15 May 2023,11:00,11:45,Meeting Room 109,Chair(s): Patanamon Thongtanunam The University of Melbourne,Development Tools & Practices I,6.0,2023-05-15T11:30:00,2023-05-15T11:36:00,Meeting Room 109,"Michael Schröder, Jürgen Cito,  Pre-print",Talk,An Exploratory Study of Ad Hoc Parsers in Python,Registered Reports
9,2023,Mon 15 May 2023,11:00,11:45,Meeting Room 109,Chair(s): Patanamon Thongtanunam The University of Melbourne,Development Tools & Practices I,6.0,2023-05-15T11:36:00,2023-05-15T11:42:00,Meeting Room 109,"Jirat Pasuksmit, Fan Jiang, Kemp Thornton, Arik Friedman, Natalija Fuksmane, Isabelle Kohout, Julian Connor,  Pre-print",Talk,Improving Agile Planning for Reliable Software Delivery,Industry Track
10,2023,Mon 15 May 2023,11:00,11:45,Meeting Room 110,Chair(s): Patanamon Thongtanunam The University of Melbourne,SE for ML,12.0,2023-05-15T11:00:00,2023-05-15T11:12:00,Meeting Room 110,"Chao Wang, Zhenpeng Chen, Minghui Zhou,  Pre-print",Talk,AutoML from Software Engineering Perspective: Landscapes and ChallengesDistinguished Paper Award,Technical Papers
11,2023,Mon 15 May 2023,11:00,11:45,Meeting Room 110,Chair(s): Patanamon Thongtanunam The University of Melbourne,SE for ML,12.0,2023-05-15T11:12:00,2023-05-15T11:24:00,Meeting Room 110,"Nima Shiri Harzevili, Jiho Shin, Junjie Wang, Song Wang, Nachiappan Nagappan",Talk,Characterizing and Understanding Software Security Vulnerabilities in Machine Learning Libraries,Technical Papers
12,2023,Mon 15 May 2023,11:00,11:45,Meeting Room 110,Chair(s): Patanamon Thongtanunam The University of Melbourne,SE for ML,6.0,2023-05-15T11:24:00,2023-05-15T11:30:00,Meeting Room 110,"Chengjie Lu, Tao Yue, Shaukat Ali,  Pre-print",Talk,DeepScenario: An Open Driving Scenario Dataset for Autonomous Driving System Testing,Data and Tool Showcase Track
13,2023,Mon 15 May 2023,11:00,11:45,Meeting Room 110,Chair(s): Patanamon Thongtanunam The University of Melbourne,SE for ML,6.0,2023-05-15T11:30:00,2023-05-15T11:36:00,Meeting Room 110,"Ratnadira Widyasari, Zhou Yang, Ferdian Thung, Sheng Qin Sim, Fiona Wee, Camellia Lok, Jack Phan, Haodi Qi, Constance Tan, Qijin Tay, David Lo",Talk,NICHE: A Curated Dataset of Engineered Machine Learning Projects in Python,Data and Tool Showcase Track
14,2023,Mon 15 May 2023,11:00,11:45,Meeting Room 110,Chair(s): Patanamon Thongtanunam The University of Melbourne,SE for ML,6.0,2023-05-15T11:36:00,2023-05-15T11:42:00,Meeting Room 110,"Wenxin Jiang, Nicholas Synovic, Purvish Jajal, Taylor R. Schorlemmer, Arav Tewari, Bhavesh Pareek, George K. Thiruvathukal, James C. Davis,  Pre-print",Talk,PTMTorrent: A Dataset for Mining Open-source Pre-trained Model Packages,Data and Tool Showcase Track
15,2023,Mon 15 May 2023,11:50,12:35,Meeting Room 109,Chair(s): Patanamon Thongtanunam The University of Melbourne,Documentation + Q&A I,12.0,2023-05-15T11:50:00,2023-05-15T12:02:00,Meeting Room 109,"Henry Tang, Sarah Nadi",Talk,Evaluating Software Documentation Quality,Technical Papers
16,2023,Mon 15 May 2023,11:50,12:35,Meeting Room 109,Chair(s): Patanamon Thongtanunam The University of Melbourne,Documentation + Q&A I,12.0,2023-05-15T12:02:00,2023-05-15T12:14:00,Meeting Room 109,"Zhou Yang, Chenyu Wang, Jieke Shi, Thong Hoang, Pavneet Singh Kochhar, Qinghua Lu, Zhenchang Xing, David Lo",Talk,What Do Users Ask in Open-Source AI Repositories? An Empirical Study of GitHub Issues,Technical Papers
17,2023,Mon 15 May 2023,11:50,12:35,Meeting Room 109,Chair(s): Patanamon Thongtanunam The University of Melbourne,Documentation + Q&A I,12.0,2023-05-15T12:14:00,2023-05-15T12:26:00,Meeting Room 109,"Ivana Clairine Irsan, Ting Zhang, Ferdian Thung, Kisub Kim, David Lo",Talk,PICASO: Enhancing API Recommendations with Relevant Stack Overflow Posts,Technical Papers
18,2023,Mon 15 May 2023,11:50,12:35,Meeting Room 109,Chair(s): Patanamon Thongtanunam The University of Melbourne,Documentation + Q&A I,6.0,2023-05-15T12:26:00,2023-05-15T12:32:00,Meeting Room 109,"Nafiseh Nikehgbal, Amir Hossein Kargaran, Abbas Heydarnoori, Hinrich Schütze,  Pre-print",Talk,GIRT-Data: Sampling GitHub Issue Report Templates,Data and Tool Showcase Track
19,2023,Mon 15 May 2023,11:50,12:35,Meeting Room 110,Chair(s): Patanamon Thongtanunam The University of Melbourne,Software Evolution & Analysis,6.0,2023-05-15T11:50:00,2023-05-15T11:56:00,Meeting Room 110,"Joshua D. Scarsbrook, Mark Utting, Ryan K. L. Ko,  Pre-print",Talk,TypeScript's Evolution: An Analysis of Feature Adoption Over Time,Technical Papers
20,2023,Mon 15 May 2023,11:50,12:35,Meeting Room 110,Chair(s): Patanamon Thongtanunam The University of Melbourne,Software Evolution & Analysis,6.0,2023-05-15T11:56:00,2023-05-15T12:02:00,Meeting Room 110,"Tobias Litzenberger, Johannes Düsing, Ben Hermann",Talk,"DGMF: Fast Generation of Comparable, Updatable Dependency Graphs for Software Repositories",Data and Tool Showcase Track
21,2023,Mon 15 May 2023,11:50,12:35,Meeting Room 110,Chair(s): Patanamon Thongtanunam The University of Melbourne,Software Evolution & Analysis,6.0,2023-05-15T12:02:00,2023-05-15T12:08:00,Meeting Room 110,"Satrio Adi Rukmono, Michel Chaudron",Talk,Enabling Analysis and Reasoning on Software Systems through Knowledge Graph Representation,Data and Tool Showcase Track
22,2023,Mon 15 May 2023,11:50,12:35,Meeting Room 110,Chair(s): Patanamon Thongtanunam The University of Melbourne,Software Evolution & Analysis,6.0,2023-05-15T12:08:00,2023-05-15T12:14:00,Meeting Room 110,"Simon Schneider, Tufan Özen, Michael Chen, Riccardo Scandariato",Talk,microSecEnD: A Dataset of Security-Enriched Dataflow Diagrams for Microservice Applications,Data and Tool Showcase Track
23,2023,Mon 15 May 2023,11:50,12:35,Meeting Room 110,Chair(s): Patanamon Thongtanunam The University of Melbourne,Software Evolution & Analysis,12.0,2023-05-15T12:14:00,2023-05-15T12:26:00,Meeting Room 110,"Alexander Nicholson, Quentin Stiévenart, Arash Mazidi, Mohammad Ghafari",Talk,Wasmizer: Curating WebAssembly-driven Projects on GitHub,Technical Papers
24,2023,Mon 15 May 2023,11:50,12:35,Meeting Room 110,Chair(s): Patanamon Thongtanunam The University of Melbourne,Software Evolution & Analysis,6.0,2023-05-15T12:26:00,2023-05-15T12:32:00,Meeting Room 110,Md Tajmilur Rahman,Talk,Feature Toggle Usage Patterns : A Case Study on Google Chromium,Technical Papers
25,2023,Mon 15 May 2023,13:45,14:15,Meeting Room 109,Chair(s): Patanamon Thongtanunam The University of Melbourne,MIP Talk,30.0,2023-05-15T13:45:00,2023-05-15T14:15:00,Meeting Room 109,"Kim Herzig, Andreas Zeller",Talk,MIP #2: The Impact of Tangled Code Changes,MIP Award
26,2023,Mon 15 May 2023,14:20,15:15,Meeting Room 109,Chair(s): Patanamon Thongtanunam The University of Melbourne,Language Models,12.0,2023-05-15T14:20:00,2023-05-15T14:32:00,Meeting Room 109,"Seif Abukhalaf, Mohammad Hamdaqa, Foutse Khomh",Talk,On Codex Prompt Engineering for OCL Generation: An Empirical Study,Technical Papers
27,2023,Mon 15 May 2023,14:20,15:15,Meeting Room 109,Chair(s): Patanamon Thongtanunam The University of Melbourne,Language Models,12.0,2023-05-15T14:32:00,2023-05-15T14:44:00,Meeting Room 109,"Bernd Gruner, Tim Sonnekalb, Thomas S. Heinze, Clemens-Alexander Brust",Talk,Cross-Domain Evaluation of a Deep Learning-Based Type Inference System,Technical Papers
28,2023,Mon 15 May 2023,14:20,15:15,Meeting Room 109,Chair(s): Patanamon Thongtanunam The University of Melbourne,Language Models,12.0,2023-05-15T14:44:00,2023-05-15T14:56:00,Meeting Room 109,"Tim van Dam, Maliheh Izadi, Arie van Deursen,  Pre-print",Talk,Enriching Source Code with Contextual Data for Code Completion Models: An Empirical Study,Technical Papers
29,2023,Mon 15 May 2023,14:20,15:15,Meeting Room 109,Chair(s): Patanamon Thongtanunam The University of Melbourne,Language Models,12.0,2023-05-15T14:56:00,2023-05-15T15:08:00,Meeting Room 109,"Iman Saberi, Fatemeh Hendijani Fard",Talk,Model-Agnostic Syntactical Information for Pre-Trained Programming Language Models,Technical Papers
30,2023,Mon 15 May 2023,14:20,15:15,Meeting Room 110,Chair(s): Patanamon Thongtanunam The University of Melbourne,Understanding Defects,12.0,2023-05-15T14:20:00,2023-05-15T14:32:00,Meeting Room 110,"Brandon Keller, Benjamin S. Meyers, Andrew Meneely",Talk,What Happens When We Fuzz? Investigating OSS-Fuzz Bug History,Technical Papers
31,2023,Mon 15 May 2023,14:20,15:15,Meeting Room 110,Chair(s): Patanamon Thongtanunam The University of Melbourne,Understanding Defects,12.0,2023-05-15T14:32:00,2023-05-15T14:44:00,Meeting Room 110,"Md Abul Kalam Azad, Nafees Iqbal, Foyzul Hassan, Probir Roy,  Pre-print",Talk,An Empirical Study of High Performance Computing (HPC) Performance Bugs,Technical Papers
32,2023,Mon 15 May 2023,14:20,15:15,Meeting Room 110,Chair(s): Patanamon Thongtanunam The University of Melbourne,Understanding Defects,6.0,2023-05-15T14:44:00,2023-05-15T14:50:00,Meeting Room 110,"Themistoklis Diamantopoulos, Dimitrios-Nikitas Nastos, Andreas Symeonidis,  Pre-print",Talk,Semantically-enriched Jira Issue Tracking Data,Data and Tool Showcase Track
33,2023,Mon 15 May 2023,14:20,15:15,Meeting Room 110,Chair(s): Patanamon Thongtanunam The University of Melbourne,Understanding Defects,6.0,2023-05-15T14:50:00,2023-05-15T14:56:00,Meeting Room 110,"Lukas Schulte, Anamaria Mojica-Hanke, Mario Linares-Vasquez, Steffen Herbold",Talk,An exploratory study of bug introducing changes: what happens when bugs are introduced in open source software?,Registered Reports
34,2023,Mon 15 May 2023,14:20,15:15,Meeting Room 110,Chair(s): Patanamon Thongtanunam The University of Melbourne,Understanding Defects,6.0,2023-05-15T14:56:00,2023-05-15T15:02:00,Meeting Room 110,"Leonhard Applis, Annibale Panichella",Talk,HasBugs - Handpicked Haskell Bugs,Data and Tool Showcase Track
35,2023,Mon 15 May 2023,14:20,15:15,Meeting Room 110,Chair(s): Patanamon Thongtanunam The University of Melbourne,Understanding Defects,6.0,2023-05-15T15:02:00,2023-05-15T15:08:00,Meeting Room 110,"Jueun Heo, Seonah Lee",Talk,An Empirical Study on the Performance of Individual Issue Label Prediction,Technical Papers
36,2023,Mon 15 May 2023,15:45,16:30,Meeting Room 109,Chair(s): Patanamon Thongtanunam The University of Melbourne,Tutorial #1,45.0,2023-05-15T15:45:00,2023-05-15T16:30:00,Meeting Room 109,Nicole Novielli,Talk,Tutorial: Recognizing Developers' Emotions Using Non-invasive Biometrics Sensors,Tutorials
37,2023,Mon 15 May 2023,15:45,16:30,Meeting Room 110,Chair(s): Patanamon Thongtanunam The University of Melbourne,Process Automation & DevOps,12.0,2023-05-15T15:45:00,2023-05-15T15:57:00,Meeting Room 110,"Hamid Mohayeji Nasrabadi, Andrei Agaronian, Eleni Constantinou, Nicola Zanone, Alexander Serebrenik",Talk,Investigating the Resolution of Vulnerable Dependencies with Dependabot Security UpdatesDistinguished Paper Award,Technical Papers
38,2023,Mon 15 May 2023,15:45,16:30,Meeting Room 110,Chair(s): Patanamon Thongtanunam The University of Melbourne,Process Automation & DevOps,12.0,2023-05-15T15:57:00,2023-05-15T16:09:00,Meeting Room 110,"José Diego Saraiva da Silva, Daniel Alencar Da Costa, Uirá Kulesza, Gustavo Sizílio, José Gameleira Neto, Roberta Coelho, Mei Nagappan",Talk,Unveiling the Relationship Between Continuous Integration and Code Coverage,Technical Papers
39,2023,Mon 15 May 2023,15:45,16:30,Meeting Room 110,Chair(s): Patanamon Thongtanunam The University of Melbourne,Process Automation & DevOps,6.0,2023-05-15T16:09:00,2023-05-15T16:15:00,Meeting Room 110,"Pablo Valenzuela-Toledo, Alexandre Bergel, Timo Kehrer, Oscar Nierstrasz",Talk,EGAD: A Moldable Tool for GitHub Action Analysis,Data and Tool Showcase Track
40,2023,Mon 15 May 2023,15:45,16:30,Meeting Room 110,Chair(s): Patanamon Thongtanunam The University of Melbourne,Process Automation & DevOps,6.0,2023-05-15T16:15:00,2023-05-15T16:21:00,Meeting Room 110,"Arik Friedman, Rohan Dhupelia, Ben Jackson,  File Attached",Talk,"The Atlassian Data Lake: consolidating enriched software development data in a single, queryable system",Industry Track
41,2023,Mon 15 May 2023,15:45,16:30,Meeting Room 110,Chair(s): Patanamon Thongtanunam The University of Melbourne,Process Automation & DevOps,6.0,2023-05-15T16:21:00,2023-05-15T16:27:00,Meeting Room 110,"Gunnar Kudrjavets, Nachiappan Nagappan, Ayushi Rastogi,  Pre-print",Talk,Are We Speeding Up or Slowing Down? On Temporal Aspects of Code Velocity,Technical Papers
42,2023,Mon 15 May 2023,16:35,17:20,Meeting Room 109,Chair(s): Patanamon Thongtanunam The University of Melbourne,Ethics & Energy,12.0,2023-05-15T16:35:00,2023-05-15T16:47:00,Meeting Room 109,"Abdul Ali Bangash, Qasim Jamal, Kalvin Eng, Karim Ali, Abram Hindle,  Pre-print",Talk,Energy Consumption Estimation of API-usage in Mobile Apps via Static Analysis,Technical Papers
43,2023,Mon 15 May 2023,16:35,17:20,Meeting Room 109,Chair(s): Patanamon Thongtanunam The University of Melbourne,Ethics & Energy,12.0,2023-05-15T16:47:00,2023-05-15T16:59:00,Meeting Room 109,"Shriram Shanbhag, Sridhar Chimalakonda,  Pre-print",Talk,An Exploratory Study on Energy Consumption of Dataframe Processing Libraries,Technical Papers
44,2023,Mon 15 May 2023,16:35,17:20,Meeting Room 109,Chair(s): Patanamon Thongtanunam The University of Melbourne,Ethics & Energy,6.0,2023-05-15T16:59:00,2023-05-15T17:05:00,Meeting Room 109,"Anne Hennig, Lukas Schulte, Steffen Herbold, Oksana Kulyk, Peter Mayer",Talk,Understanding issues related to personal data and data protection in open source projects on GitHub,Registered Reports
45,2023,Mon 15 May 2023,16:35,17:20,Meeting Room 109,Chair(s): Patanamon Thongtanunam The University of Melbourne,Ethics & Energy,12.0,2023-05-15T17:05:00,2023-05-15T17:17:00,Meeting Room 109,"Laura Duits, Isha Kashyap, Joey Bekkink, Kousar Aslam, Emitzá Guzmán",Talk,Whistleblowing and Tech on Twitter,Technical Papers
46,2023,Mon 15 May 2023,16:35,17:20,Meeting Room 110,Chair(s): Patanamon Thongtanunam The University of Melbourne,Security,12.0,2023-05-15T16:35:00,2023-05-15T16:47:00,Meeting Room 110,"Anna-Katharina Wickert, Clemens Damke, Lars Baumgärtner, Eyke Hüllermeier, Mira Mezini,  Pre-print,  File Attached",Talk,UNGOML: Automated Classification of unsafe Usages in Go,Technical Papers
47,2023,Mon 15 May 2023,16:35,17:20,Meeting Room 110,Chair(s): Patanamon Thongtanunam The University of Melbourne,Security,12.0,2023-05-15T16:47:00,2023-05-15T16:59:00,Meeting Room 110,"Gerhard Jungwirth, Aakanksha Saha, Michael Schröder, Tobias Fiebig, Martina Lindorfer, Jürgen Cito,  Pre-print",Talk,Connecting the .dotfiles: Checked-In Secret Exposure with Extra (Lateral Movement) Steps,Technical Papers
48,2023,Mon 15 May 2023,16:35,17:20,Meeting Room 110,Chair(s): Patanamon Thongtanunam The University of Melbourne,Security,12.0,2023-05-15T16:59:00,2023-05-15T17:11:00,Meeting Room 110,"Hoang H. Nguyen, Nhat-Minh Nguyen, Chunyao Xie, Zahra Ahmadi, Daniel Kudenko, Thanh-Nam Doan, Lingxiao Jiang,  Pre-print,  Media Attached",Talk,MANDO-HGT: Heterogeneous Graph Transformers for Smart Contract Vulnerability Detection,Technical Papers
49,2023,Mon 15 May 2023,16:35,17:20,Meeting Room 110,Chair(s): Patanamon Thongtanunam The University of Melbourne,Security,6.0,2023-05-15T17:11:00,2023-05-15T17:17:00,Meeting Room 110,"Setu Kumar Basak, Lorenzo Neil, Bradley Reaves, Laurie Williams,  Pre-print",Talk,SecretBench: A Dataset of Software Secrets,Data and Tool Showcase Track
50,2023,Mon 15 May 2023,18:00,21:00,Offsite,Chair(s): Patanamon Thongtanunam The University of Melbourne,"MSR Dinner at Cargo Hall, South Wharf",3.0,2023-05-15T18:00:00,2023-05-15T18:03:00,Offsite,,Meeting,"MSR Dinner at Cargo Hall, South Wharf",Technical Papers
51,2023,Tue 16 May 2023,09:00,09:45,Meeting Room 109,Chair(s): Patanamon Thongtanunam The University of Melbourne,Keynote,45.0,2023-05-16T09:00:00,2023-05-16T09:45:00,Meeting Room 109,Baishakhi Ray,Keynote,Towards Code-Aware AI Models for Code,Keynotes
52,2023,Tue 16 May 2023,09:50,10:30,Meeting Room 109,Chair(s): Patanamon Thongtanunam The University of Melbourne,Tutorial #2,40.0,2023-05-16T09:50:00,2023-05-16T10:30:00,Meeting Room 109,Christoph Gote,Tutorial,Tutorial: Mining and Analysing Collaboration in git Repositories with git2net,Tutorials
53,2023,Tue 16 May 2023,09:50,10:30,Meeting Room 110,Chair(s): Patanamon Thongtanunam The University of Melbourne,Mining Challenge,6.0,2023-05-16T09:50:00,2023-05-16T09:56:00,Meeting Room 110,"Weijie Sun, Samuel Iwuchukwu, Abdul Ali Bangash, Abram Hindle,  Pre-print",Talk,An Empirical Study to Investigate Collaboration Among Developers in Open Source Software (OSS),Mining Challenge
54,2023,Tue 16 May 2023,09:50,10:30,Meeting Room 110,Chair(s): Patanamon Thongtanunam The University of Melbourne,Mining Challenge,6.0,2023-05-16T09:56:00,2023-05-16T10:02:00,Meeting Room 110,"Arifa Islam Champa, Md Fazle Rabbi, Minhaz F. Zibran, Md Rakibul Islam,  Pre-print",Talk,Insights into Female Contributions in Open-Source Projects,Mining Challenge
55,2023,Tue 16 May 2023,09:50,10:30,Meeting Room 110,Chair(s): Patanamon Thongtanunam The University of Melbourne,Mining Challenge,6.0,2023-05-16T10:02:00,2023-05-16T10:08:00,Meeting Room 110,"Piotr Przymus, Mikołaj Fejzer, Jakub Narębski, Krzysztof Stencel,  Pre-print",Talk,The Secret Life of CVEs,Mining Challenge
56,2023,Tue 16 May 2023,09:50,10:30,Meeting Room 110,Chair(s): Patanamon Thongtanunam The University of Melbourne,Mining Challenge,6.0,2023-05-16T10:08:00,2023-05-16T10:14:00,Meeting Room 110,"Anisha Islam, Nipuni Tharushika Hewage, Abdul Ali Bangash, Abram Hindle,  Pre-print",Talk,Evolution of the Practice of Software Testing in Java Projects,Mining Challenge
57,2023,Tue 16 May 2023,09:50,10:30,Meeting Room 110,Chair(s): Patanamon Thongtanunam The University of Melbourne,Mining Challenge,6.0,2023-05-16T10:14:00,2023-05-16T10:20:00,Meeting Room 110,"Oz Kilic, Nathaniel Bowness, Olga Baysal,  Pre-print",Talk,Keep the Ball Rolling: Analyzing Release Cadence in GitHub Projects,Mining Challenge
58,2023,Tue 16 May 2023,11:00,11:45,Meeting Room 109,Chair(s): Patanamon Thongtanunam The University of Melbourne,Documentation + Q&A II,12.0,2023-05-16T11:00:00,2023-05-16T11:12:00,Meeting Room 109,"Dong Wang, Tao Xiao, Christoph Treude, Raula Gaikovina Kula, Hideaki Hata, Yasutaka Kamei,  Pre-print",Talk,Understanding the Role of Images on Stack Overflow,Technical Papers
59,2023,Tue 16 May 2023,11:00,11:45,Meeting Room 109,Chair(s): Patanamon Thongtanunam The University of Melbourne,Documentation + Q&A II,12.0,2023-05-16T11:12:00,2023-05-16T11:24:00,Meeting Room 109,"Saikat Mondal, Masud Rahman, Chanchal K. Roy,  Pre-print",Talk,Do Subjectivity and Objectivity Always Agree? A Case Study with Stack Overflow Questions,Technical Papers
60,2023,Tue 16 May 2023,11:00,11:45,Meeting Room 109,Chair(s): Patanamon Thongtanunam The University of Melbourne,Documentation + Q&A II,6.0,2023-05-16T11:24:00,2023-05-16T11:30:00,Meeting Room 109,"Joseph Vargovich, Fabio Marcos De Abreu Santos, Jacob Penney, Marco Gerosa, Igor Steinmacher,  Pre-print,  Media Attached",Talk,GiveMeLabeledIssues: An Open Source Issue Recommendation System,Data and Tool Showcase Track
61,2023,Tue 16 May 2023,11:00,11:45,Meeting Room 109,Chair(s): Patanamon Thongtanunam The University of Melbourne,Documentation + Q&A II,6.0,2023-05-16T11:30:00,2023-05-16T11:36:00,Meeting Room 109,"Akhila Sri Manasa Venigalla, Sridhar Chimalakonda",Talk,DocMine: A Software Documentation-Related Dataset of 950 GitHub Repositories,Data and Tool Showcase Track
62,2023,Tue 16 May 2023,11:00,11:45,Meeting Room 109,Chair(s): Patanamon Thongtanunam The University of Melbourne,Documentation + Q&A II,6.0,2023-05-16T11:36:00,2023-05-16T11:42:00,Meeting Room 109,"Murali Sridharan, Leevi Rantala, Mika Mäntylä",Talk,"PENTACET data - 23 Million Code Comments and 500,000 SATD comments",Data and Tool Showcase Track
63,2023,Tue 16 May 2023,11:00,11:45,Meeting Room 110,Chair(s): Patanamon Thongtanunam The University of Melbourne,Code Smells,12.0,2023-05-16T11:00:00,2023-05-16T11:12:00,Meeting Room 110,"Anderson Oliveira, João Lucas Correia, Leonardo Da Silva Sousa, Wesley Assunção, Daniel Coutinho, Alessandro Garcia, Willian Oizumi, Caio Barbosa, Anderson Uchôa, Juliana Alves Pereira,  Pre-print",Talk,Don't Forget the Exception! Considering Robustness Changes to Identify Design Problems,Technical Papers
64,2023,Tue 16 May 2023,11:00,11:45,Meeting Room 110,Chair(s): Patanamon Thongtanunam The University of Melbourne,Code Smells,12.0,2023-05-16T11:12:00,2023-05-16T11:24:00,Meeting Room 110,"mawenhao , Yaoxiang Yu, Xiaoming Ruan, Bo Cai",Talk,Pre-trained Model Based Feature Envy Detection,Technical Papers
65,2023,Tue 16 May 2023,11:00,11:45,Meeting Room 110,Chair(s): Patanamon Thongtanunam The University of Melbourne,Code Smells,6.0,2023-05-16T11:24:00,2023-05-16T11:30:00,Meeting Room 110,"Tom Mashiach, Bruno Sotto-Mayor, Gal Kaminka, Meir Kalech",Talk,CLEAN++: Code Smells Extraction for C++,Data and Tool Showcase Track
66,2023,Tue 16 May 2023,11:00,11:45,Meeting Room 110,Chair(s): Patanamon Thongtanunam The University of Melbourne,Code Smells,6.0,2023-05-16T11:30:00,2023-05-16T11:36:00,Meeting Room 110,"Himesh Nandani, Mootez Saad, Tushar Sharma,  Pre-print,  File Attached",Talk,DACOS-A Manually Annotated Dataset of Code Smells,Data and Tool Showcase Track
67,2023,Tue 16 May 2023,11:00,11:45,Meeting Room 110,Chair(s): Patanamon Thongtanunam The University of Melbourne,Code Smells,6.0,2023-05-16T11:36:00,2023-05-16T11:42:00,Meeting Room 110,"Gunnar Kudrjavets, Aditya Kumar, Ayushi Rastogi,  Pre-print",Talk,What Warnings Do Engineers Really Fix? The Compiler That Cried Wolf,Industry Track
68,2023,Tue 16 May 2023,11:50,12:35,Meeting Room 109,Chair(s): Patanamon Thongtanunam The University of Melbourne,Development Tools & Practices II,12.0,2023-05-16T11:50:00,2023-05-16T12:02:00,Meeting Room 109,"Imam Nur Bani Yusuf, Diyanah Binte Abdul Jamal, Lingxiao Jiang,  Pre-print",Talk,Automating Arduino Programming: From Hardware Setups to Sample Source Code Generation,Technical Papers
69,2023,Tue 16 May 2023,11:50,12:35,Meeting Room 109,Chair(s): Patanamon Thongtanunam The University of Melbourne,Development Tools & Practices II,6.0,2023-05-16T12:02:00,2023-05-16T12:08:00,Meeting Room 109,"Natarajan Chidambaram, Alexandre Decan , Tom Mens",Talk,A Dataset of Bot and Human Activities in GitHub,Data and Tool Showcase Track
70,2023,Tue 16 May 2023,11:50,12:35,Meeting Room 109,Chair(s): Patanamon Thongtanunam The University of Melbourne,Development Tools & Practices II,6.0,2023-05-16T12:08:00,2023-05-16T12:14:00,Meeting Room 109,"Morakot Choetkiertikul, Apirak Hoonlor, Chaiyong Ragkhitwetsagul, Siripen Pongpaichet, Thanwadee Sunetnanta, Tasha Settewong, Raula Gaikovina Kula",Talk,Mining the Characteristics of Jupyter Notebooks in Data Science Projects,Registered Reports
71,2023,Tue 16 May 2023,11:50,12:35,Meeting Room 109,Chair(s): Patanamon Thongtanunam The University of Melbourne,Development Tools & Practices II,6.0,2023-05-16T12:14:00,2023-05-16T12:20:00,Meeting Room 109,"Konstantin Grotov, Sergey Titov, Alexandr Suhinin, Yaroslav Golubev, Timofey Bryksin,  Pre-print",Talk,Optimizing Duplicate Size Thresholds in IDEs,Industry Track
