id,year,date,session_start,session_end,room,chair,session_title,duration,dtstart,dtend,location,author,type,title,topic
70,2022,Thu 19 May 2022,03:00,03:50,MSR Main room - odd hours,"Chair(s): Maxime Lamothe, Jin L.C. Guo",Session 8: Large-Scale Mining & Software Ecosystems,13.0,2022-05-19T03:37:00,2022-05-19T03:50:00,MSR Main room - odd hours,,Live Q&A,Discussions and Q&A,Technical Papers
71,2022,Thu 19 May 2022,04:00,04:50,MSR Main room - even hours,"Chair(s): Maxime Lamothe, Jin L.C. Guo",Session 9: Scaling & Cloud,4.0,2022-05-19T04:00:00,2022-05-19T04:04:00,MSR Main room - even hours,"Arun KP, Saurabh Kumar, Debadatta Mishra, Biswabandan Panda,  DOI,  Pre-print",Talk,SniP: An Efficient Stack Tracing Framework for Multi-threaded Programs,Data and Tool Showcase Track
72,2022,Thu 19 May 2022,04:00,04:50,MSR Main room - even hours,"Chair(s): Maxime Lamothe, Jin L.C. Guo",Session 9: Scaling & Cloud,4.0,2022-05-19T04:04:00,2022-05-19T04:08:00,MSR Main room - even hours,"Fabian Heseding, Willy Scheibel, Jürgen Döllner",Talk,Tooling for Time- and Space-efficient git Repository Mining,Data and Tool Showcase Track
73,2022,Thu 19 May 2022,04:00,04:50,MSR Main room - even hours,"Chair(s): Maxime Lamothe, Jin L.C. Guo",Session 9: Scaling & Cloud,4.0,2022-05-19T04:08:00,2022-05-19T04:12:00,MSR Main room - even hours,"Cedric Richter, Heike Wehrheim,  Pre-print,  Media Attached",Talk,TSSB-3M: Mining single statement bugs at massive scale,Data and Tool Showcase Track
74,2022,Thu 19 May 2022,04:00,04:50,MSR Main room - even hours,"Chair(s): Maxime Lamothe, Jin L.C. Guo",Session 9: Scaling & Cloud,7.0,2022-05-19T04:12:00,2022-05-19T04:19:00,MSR Main room - even hours,"Mahesh Venkataraman, Reuben George, Jeff Wilkinson",Talk,Improved Business Outcomes from Cloud Applications – using Integrated Process and Runtime Product Data Mining,Industry Track
75,2022,Thu 19 May 2022,04:00,04:50,MSR Main room - even hours,"Chair(s): Maxime Lamothe, Jin L.C. Guo",Session 9: Scaling & Cloud,7.0,2022-05-19T04:19:00,2022-05-19T04:26:00,MSR Main room - even hours,"Mallika Fernandes, Rohit Patwardhan",Talk,Improve Quality of Cloud Serverless Architectures through Software Repository Mining,Industry Track
76,2022,Thu 19 May 2022,04:00,04:50,MSR Main room - even hours,"Chair(s): Maxime Lamothe, Jin L.C. Guo",Session 9: Scaling & Cloud,4.0,2022-05-19T04:26:00,2022-05-19T04:30:00,MSR Main room - even hours,"Fabiano Pecorelli, Giovanni Grano, Fabio Palomba, Harald C. Gall, Andrea De Lucia,  Pre-print",Talk,Toward Granular Automatic Unit Test Case Generation,Registered Reports
77,2022,Thu 19 May 2022,04:00,04:50,MSR Main room - even hours,"Chair(s): Maxime Lamothe, Jin L.C. Guo",Session 9: Scaling & Cloud,20.0,2022-05-19T04:30:00,2022-05-19T04:50:00,MSR Main room - even hours,,Live Q&A,Discussions and Q&A,Technical Papers
78,2022,Thu 19 May 2022,05:00,05:50,MSR Main room - odd hours,"Chair(s): Maxime Lamothe, Jin L.C. Guo",Session 10: Security,4.0,2022-05-19T05:00:00,2022-05-19T05:04:00,MSR Main room - odd hours,"Barbara Russo, Matteo Camilli, Moritz Mock,  DOI,  Pre-print,  Media Attached",Short-paper,WeakSATD: detecting weak self-admitted technical debt,Technical Papers
79,2022,Thu 19 May 2022,05:00,05:50,MSR Main room - odd hours,"Chair(s): Maxime Lamothe, Jin L.C. Guo",Session 10: Security,7.0,2022-05-19T05:04:00,2022-05-19T05:11:00,MSR Main room - odd hours,"Wei Tang, Yanlin Wang, Hongyu Zhang, Shi Han, Ping Luo, Dongmei Zhang,  Pre-print",Talk,LibDB: An Effective and Efficient Framework for Detecting Third-Party Libraries in Binaries,Technical Papers
80,2022,Thu 19 May 2022,05:00,05:50,MSR Main room - odd hours,"Chair(s): Maxime Lamothe, Jin L.C. Guo",Session 10: Security,7.0,2022-05-19T05:11:00,2022-05-19T05:18:00,MSR Main room - odd hours,"Roland Croft, Muhammad Ali Babar, Huaming Chen",Talk,Noisy Label Learning for Security Defects,Technical Papers
81,2022,Thu 19 May 2022,05:00,05:50,MSR Main room - odd hours,"Chair(s): Maxime Lamothe, Jin L.C. Guo",Session 10: Security,4.0,2022-05-19T05:18:00,2022-05-19T05:22:00,MSR Main room - odd hours,"Quang-Cuong Bui, Riccardo Scandariato, Nicolás E. Díaz Ferreyra,  Pre-print,  Media Attached",Talk,Vul4J: A Dataset of Reproducible Java Vulnerabilities Geared Towards the Study of Program Repair TechniquesData and Tool Showcase Award,Data and Tool Showcase Track
82,2022,Thu 19 May 2022,05:00,05:50,MSR Main room - odd hours,"Chair(s): Maxime Lamothe, Jin L.C. Guo",Session 10: Security,4.0,2022-05-19T05:22:00,2022-05-19T05:26:00,MSR Main room - odd hours,"Saurabh Kumar, Debadatta Mishra, Biswabandan Panda, Sandeep K. Shukla,  DOI,  Pre-print,  Media Attached",Talk,AndroOBFS: Time-tagged Obfuscated Android Malware Dataset with Family Information,Data and Tool Showcase Track
83,2022,Thu 19 May 2022,05:00,05:50,MSR Main room - odd hours,"Chair(s): Maxime Lamothe, Jin L.C. Guo",Session 10: Security,4.0,2022-05-19T05:26:00,2022-05-19T05:30:00,MSR Main room - odd hours,"Jordan Samhi, Tegawendé F. Bissyandé, Jacques Klein,  DOI,  Pre-print,  Media Attached",Talk,TriggerZoo: A Dataset of Android Applications Automatically Infected with Logic Bombs,Data and Tool Showcase Track
84,2022,Thu 19 May 2022,05:00,05:50,MSR Main room - odd hours,"Chair(s): Maxime Lamothe, Jin L.C. Guo",Session 10: Security,4.0,2022-05-19T05:30:00,2022-05-19T05:34:00,MSR Main room - odd hours,"Michael Schlichtig, Anna-Katharina Wickert, Stefan Krüger, Eric Bodden, Mira Mezini,  Pre-print",Talk,CamBench - Cryptographic API Misuse Detection Tool Benchmark Suite,Registered Reports
85,2022,Thu 19 May 2022,05:00,05:50,MSR Main room - odd hours,"Chair(s): Maxime Lamothe, Jin L.C. Guo",Session 10: Security,16.0,2022-05-19T05:34:00,2022-05-19T05:50:00,MSR Main room - odd hours,,Live Q&A,Discussions and Q&A,Technical Papers
86,2022,Thu 19 May 2022,11:00,11:50,MSR Main room - odd hours,"Chair(s): Maxime Lamothe, Jin L.C. Guo",Session 11: Machine Learning & Information Retrieval,4.0,2022-05-19T11:00:00,2022-05-19T11:04:00,MSR Main room - odd hours,"Rajeswari Hita Kambhamettu, John Billos, Carolyn ""Tomi"" Oluwaseun-Apo, Benjamin Gafford, Rohan Padhye, Vincent J. Hellendoorn",Short-paper,On the Naturalness of Fuzzer Generated Code,Technical Papers
87,2022,Thu 19 May 2022,11:00,11:50,MSR Main room - odd hours,"Chair(s): Maxime Lamothe, Jin L.C. Guo",Session 11: Machine Learning & Information Retrieval,7.0,2022-05-19T11:04:00,2022-05-19T11:11:00,MSR Main room - odd hours,"Jingzhi Gong, Tao Chen,  DOI,  Pre-print,  Media Attached",Talk,Does Configuration Encoding Matter in Learning Software Performance? An Empirical Study on Encoding Schemes,Technical Papers
88,2022,Thu 19 May 2022,11:00,11:50,MSR Main room - odd hours,"Chair(s): Maxime Lamothe, Jin L.C. Guo",Session 11: Machine Learning & Information Retrieval,7.0,2022-05-19T11:11:00,2022-05-19T11:18:00,MSR Main room - odd hours,"Ekaterina Koshchenko, Egor Klimov, Vladimir Kovalenko",Talk,Multimodal Recommendation of Messenger Channels,Technical Papers
89,2022,Thu 19 May 2022,11:00,11:50,MSR Main room - odd hours,"Chair(s): Maxime Lamothe, Jin L.C. Guo",Session 11: Machine Learning & Information Retrieval,7.0,2022-05-19T11:18:00,2022-05-19T11:25:00,MSR Main room - odd hours,"Fran Silavong, Sean Moran, Antonios Georgiadis, Rohan Saphal, Robert Otter,  DOI,  Pre-print,  Media Attached",Talk,Senatus: A Fast and Accurate Code-to-Code Recommendation Engine,Technical Papers
90,2022,Thu 19 May 2022,11:00,11:50,MSR Main room - odd hours,"Chair(s): Maxime Lamothe, Jin L.C. Guo",Session 11: Machine Learning & Information Retrieval,7.0,2022-05-19T11:25:00,2022-05-19T11:32:00,MSR Main room - odd hours,"Tatiana Castro Vélez, Raffi Khatchadourian, Mehdi Bagherzadeh, Anita Raja,  Pre-print,  Media Attached",Talk,Challenges in Migrating Imperative Deep Learning Programs to Graph Execution: An Empirical Study,Technical Papers
91,2022,Thu 19 May 2022,11:00,11:50,MSR Main room - odd hours,"Chair(s): Maxime Lamothe, Jin L.C. Guo",Session 11: Machine Learning & Information Retrieval,7.0,2022-05-19T11:32:00,2022-05-19T11:39:00,MSR Main room - odd hours,"Wei Ma, Mengjie Zhao, Ezekiel Soremekun, Qiang Hu, Jie M. Zhang, Mike Papadakis, Maxime Cordy, Xiaofei Xie, Yves Le Traon,  Pre-print",Talk,GraphCode2Vec: Generic Code Embedding via Lexical and Program Dependence Analyses,Technical Papers
92,2022,Thu 19 May 2022,11:00,11:50,MSR Main room - odd hours,"Chair(s): Maxime Lamothe, Jin L.C. Guo",Session 11: Machine Learning & Information Retrieval,11.0,2022-05-19T11:39:00,2022-05-19T11:50:00,MSR Main room - odd hours,,Live Q&A,Discussions and Q&A,Technical Papers
93,2022,Thu 19 May 2022,12:00,12:51,MSR Plenary room,"Chair(s): Maxime Lamothe, Jin L.C. Guo",Vision & Reflections Track: Past,10.0,2022-05-19T12:00:00,2022-05-19T12:10:00,MSR Plenary room,Audris Mockus,Talk,Back to the future: Empirical Revolution(s) in Software Engineering,Technical Papers
94,2022,Thu 19 May 2022,12:00,12:51,MSR Plenary room,"Chair(s): Maxime Lamothe, Jin L.C. Guo",Vision & Reflections Track: Past,10.0,2022-05-19T12:10:00,2022-05-19T12:20:00,MSR Plenary room,Ahmed E. Hassan,Talk,Engineering the MSR Field and the Joy of Research,Technical Papers
95,2022,Thu 19 May 2022,12:00,12:51,MSR Plenary room,"Chair(s): Maxime Lamothe, Jin L.C. Guo",Vision & Reflections Track: Past,10.0,2022-05-19T12:20:00,2022-05-19T12:30:00,MSR Plenary room,Daniela Damian,Talk,It's all in your network: How mining developer collaboration allowed us to peer into complex socio-technical aspects of software development,Technical Papers
96,2022,Thu 19 May 2022,12:00,12:51,MSR Plenary room,"Chair(s): Maxime Lamothe, Jin L.C. Guo",Vision & Reflections Track: Past,21.0,2022-05-19T12:30:00,2022-05-19T12:51:00,MSR Plenary room,,Other,Discussion,Technical Papers
97,2022,Thu 19 May 2022,13:00,13:51,MSR Plenary room,"Chair(s): Maxime Lamothe, Jin L.C. Guo",Vision & Reflections Track: Future,10.0,2022-05-19T13:00:00,2022-05-19T13:10:00,MSR Plenary room,Alexander Serebrenik,Talk,Bias in MSR research,Technical Papers
98,2022,Thu 19 May 2022,13:00,13:51,MSR Plenary room,"Chair(s): Maxime Lamothe, Jin L.C. Guo",Vision & Reflections Track: Future,10.0,2022-05-19T13:10:00,2022-05-19T13:20:00,MSR Plenary room,Denae Ford,Talk,The Next Generation of Software Developers,Technical Papers
99,2022,Thu 19 May 2022,13:00,13:51,MSR Plenary room,"Chair(s): Maxime Lamothe, Jin L.C. Guo",Vision & Reflections Track: Future,10.0,2022-05-19T13:20:00,2022-05-19T13:30:00,MSR Plenary room,Foutse Khomh,Talk,Mining Software Repositories in the age of AI,Technical Papers
100,2022,Thu 19 May 2022,13:00,13:51,MSR Plenary room,"Chair(s): Maxime Lamothe, Jin L.C. Guo",Vision & Reflections Track: Future,21.0,2022-05-19T13:30:00,2022-05-19T13:51:00,MSR Plenary room,,Other,Discussion,Technical Papers
101,2022,Thu 19 May 2022,14:00,14:50,MSR Plenary room,"Chair(s): Maxime Lamothe, Jin L.C. Guo",MIP Award Session,50.0,2022-05-19T14:00:00,2022-05-19T14:50:00,MSR Plenary room,"Georgios Gousios, Diomidis Spinellis",Talk,MIP Award Talk,MIP Award 
102,2022,Thu 19 May 2022,20:00,20:50,MSR Main room - even hours,"Chair(s): Maxime Lamothe, Jin L.C. Guo",Session 12: Integration & Large-Scale Mining,4.0,2022-05-19T20:00:00,2022-05-19T20:04:00,MSR Main room - even hours,"Julius Musseau, John Speed Meyers, George P. Sieniawski, C. Albert Thompson, Daniel M. German",Short-paper,Is Open Source Eating the World’s Software? Measuring the Proportion of Open Source in proprietary software using Java Binaries,Technical Papers
103,2022,Thu 19 May 2022,20:00,20:50,MSR Main room - even hours,"Chair(s): Maxime Lamothe, Jin L.C. Guo",Session 12: Integration & Large-Scale Mining,7.0,2022-05-19T20:04:00,2022-05-19T20:11:00,MSR Main room - even hours,"Gunnar Kudrjavets, Aditya Kumar, Nachiappan Nagappan, Ayushi Rastogi,  DOI,  Pre-print",Talk,Mining Code Review Data to Understand Waiting Times Between Acceptance and Merging: An Empirical Analysis,Technical Papers
104,2022,Thu 19 May 2022,20:00,20:50,MSR Main room - even hours,"Chair(s): Maxime Lamothe, Jin L.C. Guo",Session 12: Integration & Large-Scale Mining,7.0,2022-05-19T20:11:00,2022-05-19T20:18:00,MSR Main room - even hours,"Suvodeep Majumder, Tianpei Xia, Rahul Krishna, Tim Menzies,  Pre-print,  Media Attached",Talk,Methods for Stabilizing Models across Large Samples of Projects(with case studies on Predicting Defect and Project Health),Technical Papers
105,2022,Thu 19 May 2022,20:00,20:50,MSR Main room - even hours,"Chair(s): Maxime Lamothe, Jin L.C. Guo",Session 12: Integration & Large-Scale Mining,7.0,2022-05-19T20:18:00,2022-05-19T20:25:00,MSR Main room - even hours,"Gunnar Kudrjavets, Nachiappan Nagappan, Ayushi Rastogi,  DOI,  Pre-print",Talk,Do Small Code Changes Merge Faster? A Multi-Language Empirical Investigation,Technical Papers
106,2022,Thu 19 May 2022,20:00,20:50,MSR Main room - even hours,"Chair(s): Maxime Lamothe, Jin L.C. Guo",Session 12: Integration & Large-Scale Mining,7.0,2022-05-19T20:25:00,2022-05-19T20:32:00,MSR Main room - even hours,"Irving Muller Rodrigues, Daniel Aloise, Eraldo Rezende Fernandes,  DOI,  Pre-print",Talk,FaST: A linear time stack trace alignment heuristic for crash report deduplication,Technical Papers
107,2022,Thu 19 May 2022,20:00,20:50,MSR Main room - even hours,"Chair(s): Maxime Lamothe, Jin L.C. Guo",Session 12: Integration & Large-Scale Mining,4.0,2022-05-19T20:32:00,2022-05-19T20:36:00,MSR Main room - even hours,"Asma Razgallah, Raphael Khoury, Jean-Baptiste Poulet",Talk,TwinDroid: A Dataset of Android app System call traces and Trace Generation Pipeline,Data and Tool Showcase Track
108,2022,Thu 19 May 2022,20:00,20:50,MSR Main room - even hours,"Chair(s): Maxime Lamothe, Jin L.C. Guo",Session 12: Integration & Large-Scale Mining,14.0,2022-05-19T20:36:00,2022-05-19T20:50:00,MSR Main room - even hours,,Live Q&A,Discussions and Q&A,Technical Papers
109,2022,Thu 19 May 2022,21:00,21:50,MSR Main room - odd hours,"Chair(s): Maxime Lamothe, Jin L.C. Guo",Session 13: Security & Quality,7.0,2022-05-19T21:00:00,2022-05-19T21:07:00,MSR Main room - odd hours,"Triet Le Huynh Minh, Muhammad Ali Babar,  Pre-print",Talk,On the Use of Fine-grained Vulnerable Code Statements for Software Vulnerability Assessment Models,Technical Papers
110,2022,Thu 19 May 2022,21:00,21:50,MSR Main room - odd hours,"Chair(s): Maxime Lamothe, Jin L.C. Guo",Session 13: Security & Quality,7.0,2022-05-19T21:07:00,2022-05-19T21:14:00,MSR Main room - odd hours,"David Hin, Andrey Kan, Huaming Chen, Muhammad Ali Babar",Talk,LineVD: Statement-level Vulnerability Detection using Graph Neural Networks,Technical Papers
111,2022,Thu 19 May 2022,21:00,21:50,MSR Main room - odd hours,"Chair(s): Maxime Lamothe, Jin L.C. Guo",Session 13: Security & Quality,7.0,2022-05-19T21:14:00,2022-05-19T21:21:00,MSR Main room - odd hours,"Michael Fu, Kla Tantithamthavorn,  Pre-print",Talk,LineVul: A Transformer-based Line-Level Vulnerability Prediction,Technical Papers
112,2022,Thu 19 May 2022,21:00,21:50,MSR Main room - odd hours,"Chair(s): Maxime Lamothe, Jin L.C. Guo",Session 13: Security & Quality,4.0,2022-05-19T21:21:00,2022-05-19T21:25:00,MSR Main room - odd hours,"Jinyoung Kim, Misoo Kim, Eunseok Lee",Talk,ECench: An Energy Bug Benchmark of Ethereum Client Software,Data and Tool Showcase Track
113,2022,Thu 19 May 2022,21:00,21:50,MSR Main room - odd hours,"Chair(s): Maxime Lamothe, Jin L.C. Guo",Session 13: Security & Quality,7.0,2022-05-19T21:25:00,2022-05-19T21:32:00,MSR Main room - odd hours,"Kim Herzig, Luke Gostling, Maximilian Grothusmann, Nora Huang, Sascha Just, Alan Klimowski, Yashasvini Ramkumar, Myles McLeroy, Kıvanç Muşlu, Hitesh Sajnani, Varsha Vadaga",Talk,Microsoft CloudMine: Data Mining for the Executive Order on Improving the Nation’s Cybersecurity,Industry Track
114,2022,Thu 19 May 2022,21:00,21:50,MSR Main room - odd hours,"Chair(s): Maxime Lamothe, Jin L.C. Guo",Session 13: Security & Quality,4.0,2022-05-19T21:32:00,2022-05-19T21:36:00,MSR Main room - odd hours,"Mohamad Khajezade, Fatemeh Hendijani Fard, Mohamed S Shehata,  Pre-print",Talk,Evaluating few shot and Contrastive learning Methods for Code Clone Detection,Registered Reports
115,2022,Thu 19 May 2022,21:00,21:50,MSR Main room - odd hours,"Chair(s): Maxime Lamothe, Jin L.C. Guo",Session 13: Security & Quality,14.0,2022-05-19T21:36:00,2022-05-19T21:50:00,MSR Main room - odd hours,,Live Q&A,Discussions and Q&A,Technical Papers
116,2022,Thu 19 May 2022,22:00,22:50,MSR Plenary room,"Chair(s): Maxime Lamothe, Jin L.C. Guo",Foundational Contribution Award Session,50.0,2022-05-19T22:00:00,2022-05-19T22:50:00,MSR Plenary room,"Dongmei Zhang, Tao Xie",Awards,MSR Foundational Contribution Award,Technical Papers
117,2022,Fri 20 May 2022,04:00,04:50,MSR Main room - even hours,"Chair(s): Maxime Lamothe, Jin L.C. Guo",Session 14: Software Quality,4.0,2022-05-20T04:00:00,2022-05-20T04:04:00,MSR Main room - even hours,"Yuxiang Gao, Yi Zhu, Qiao YU,  Pre-print",Short-paper,Evaluating the effectiveness of local explanation methods on source code-based defect prediction models,Technical Papers
118,2022,Fri 20 May 2022,04:00,04:50,MSR Main room - even hours,"Chair(s): Maxime Lamothe, Jin L.C. Guo",Session 14: Software Quality,7.0,2022-05-20T04:04:00,2022-05-20T04:11:00,MSR Main room - even hours,"Fiorella Zampetti, Vittoria Nardone, Massimiliano Di Penta",Talk,Problems and Solutions in Applying Continuous Integration and Delivery to 20 Open-Source Cyber-Physical Systems,Technical Papers
119,2022,Fri 20 May 2022,04:00,04:50,MSR Main room - even hours,"Chair(s): Maxime Lamothe, Jin L.C. Guo",Session 14: Software Quality,7.0,2022-05-20T04:11:00,2022-05-20T04:18:00,MSR Main room - even hours,"Justus Bogner, Manuel Merkel,  Pre-print",Talk,To Type or Not to Type? A Systematic Comparison of the Software Quality of JavaScript and TypeScript Applications on GitHub,Technical Papers
120,2022,Fri 20 May 2022,04:00,04:50,MSR Main room - even hours,"Chair(s): Maxime Lamothe, Jin L.C. Guo",Session 14: Software Quality,7.0,2022-05-20T04:18:00,2022-05-20T04:25:00,MSR Main room - even hours,"Masateru Tsunoda, Akito Monden, Koji Toda, Amjed Tahir, Kwabena Ebo Bennin, Keitaro Nakasai, Masataka Nagura, Kenichi Matsumoto,  Pre-print",Talk,Using Bandit Algorithms for Selecting Feature Reduction Techniques in Software Defect Prediction,Technical Papers
121,2022,Fri 20 May 2022,04:00,04:50,MSR Main room - even hours,"Chair(s): Maxime Lamothe, Jin L.C. Guo",Session 14: Software Quality,4.0,2022-05-20T04:25:00,2022-05-20T04:29:00,MSR Main room - even hours,"Yoshiki Higo, Shinsuke Matsumoto, Shinji Kusumoto, Kazuya Yasuda,  Media Attached",Talk,Constructing Dataset of Functionally Equivalent Java Methods Using Automated Test Generation Techniques,Data and Tool Showcase Track
122,2022,Fri 20 May 2022,04:00,04:50,MSR Main room - even hours,"Chair(s): Maxime Lamothe, Jin L.C. Guo",Session 14: Software Quality,7.0,2022-05-20T04:29:00,2022-05-20T04:36:00,MSR Main room - even hours,"Yegor Bugayenko, Kirill Daniakin, Mirko Farina, Firas Jolha, Artem Kruglov, Witold Pedrycz, Giancarlo Succi",Talk,Extracting corrective actions from code repositories,Industry Track
123,2022,Fri 20 May 2022,04:00,04:50,MSR Main room - even hours,"Chair(s): Maxime Lamothe, Jin L.C. Guo",Session 14: Software Quality,14.0,2022-05-20T04:36:00,2022-05-20T04:50:00,MSR Main room - even hours,,Live Q&A,Discussions and Q&A,Technical Papers
124,2022,Fri 20 May 2022,11:00,11:50,MSR Main room - odd hours,"Chair(s): Maxime Lamothe, Jin L.C. Guo",Session 15: Collaboration & Open Source,7.0,2022-05-20T11:00:00,2022-05-20T11:07:00,MSR Main room - odd hours,"Eman Abdullah AlOmar, Moataz Chouchen, Mohamed Wiem Mkaouer, Ali Ouni,  Pre-print",Talk,Code Review Practices for Refactoring Changes: An Empirical Study on OpenStack,Technical Papers
125,2022,Fri 20 May 2022,11:00,11:50,MSR Main room - odd hours,"Chair(s): Maxime Lamothe, Jin L.C. Guo",Session 15: Collaboration & Open Source,4.0,2022-05-20T11:07:00,2022-05-20T11:11:00,MSR Main room - odd hours,"Viktor Csuvik, László Vidács,  File Attached",Talk,FixJS: A Dataset of Bug-fixing JavaScript Commits,Data and Tool Showcase Track
126,2022,Fri 20 May 2022,11:00,11:50,MSR Main room - odd hours,"Chair(s): Maxime Lamothe, Jin L.C. Guo",Session 15: Collaboration & Open Source,4.0,2022-05-20T11:11:00,2022-05-20T11:15:00,MSR Main room - odd hours,"Bruno L. Sousa, Mariza Bigonha, Kecia A. M. Ferreira, Glaura C. Franco,  DOI,  Pre-print,  Media Attached",Talk,A Time Series-Based Dataset of Open-Source Software Evolution,Data and Tool Showcase Track
127,2022,Fri 20 May 2022,11:00,11:50,MSR Main room - odd hours,"Chair(s): Maxime Lamothe, Jin L.C. Guo",Session 15: Collaboration & Open Source,4.0,2022-05-20T11:15:00,2022-05-20T11:19:00,MSR Main room - odd hours,"Sourya Dey, Walt Woods,  Pre-print,  Media Attached",Talk,LAGOON: An Analysis Tool for Open Source Communities,Data and Tool Showcase Track
128,2022,Fri 20 May 2022,11:00,11:50,MSR Main room - odd hours,"Chair(s): Maxime Lamothe, Jin L.C. Guo",Session 15: Collaboration & Open Source,4.0,2022-05-20T11:19:00,2022-05-20T11:23:00,MSR Main room - odd hours,"Vali Tawosi, Afnan Al-Subaihin, Rebecca Moussa, Federica Sarro,  Link to publication,  DOI,  Pre-print,  Media Attached",Talk,A Versatile Dataset of Agile Open Source Software Projects,Data and Tool Showcase Track
129,2022,Fri 20 May 2022,11:00,11:50,MSR Main room - odd hours,"Chair(s): Maxime Lamothe, Jin L.C. Guo",Session 15: Collaboration & Open Source,7.0,2022-05-20T11:23:00,2022-05-20T11:30:00,MSR Main room - odd hours,"Ayomide Bakare, Yegor Bugayenko, Arina Cheverda, Mirko Farina, Artem Kruglov, Witold Pedrycz, Giancarlo Succi",Talk,Automatically Prioritizing and Assigning Tasks from Code Repositories in Puzzle Driven Development,Industry Track
130,2022,Fri 20 May 2022,11:00,11:50,MSR Main room - odd hours,"Chair(s): Maxime Lamothe, Jin L.C. Guo",Session 15: Collaboration & Open Source,4.0,2022-05-20T11:30:00,2022-05-20T11:34:00,MSR Main room - odd hours,"Tavian Barnes, Ken Jen Lee, Cristina Tavares, Gema Rodríguez-Pérez, Mei Nagappan,  Pre-print",Talk,Towards Understanding Barriers and Mitigation Strategies of Software Engineers with Non-traditional Educational and Occupational Backgrounds,Registered Reports
131,2022,Fri 20 May 2022,11:00,11:50,MSR Main room - odd hours,"Chair(s): Maxime Lamothe, Jin L.C. Guo",Session 15: Collaboration & Open Source,4.0,2022-05-20T11:34:00,2022-05-20T11:38:00,MSR Main room - odd hours,"Alejandro Valezate, Rafael Capilla, Gregorio Robles, Victor Salamanca,  Pre-print",Talk,Can instability variations warn developers when open-source projects boost?,Registered Reports
132,2022,Fri 20 May 2022,11:00,11:50,MSR Main room - odd hours,"Chair(s): Maxime Lamothe, Jin L.C. Guo",Session 15: Collaboration & Open Source,12.0,2022-05-20T11:38:00,2022-05-20T11:50:00,MSR Main room - odd hours,,Live Q&A,Discussions and Q&A,Technical Papers
133,2022,Fri 20 May 2022,12:00,12:50,MSR Main room - odd hours,"Chair(s): Maxime Lamothe, Jin L.C. Guo",Tutorial: Using Datalore for Reproducible Research,50.0,2022-05-20T12:00:00,2022-05-20T12:50:00,MSR Main room - odd hours,Jodie Burchell,Tutorial,Using Datalore for Reproducible Research,Tutorials
134,2022,Fri 20 May 2022,13:00,13:50,MSR Main room - odd hours,"Chair(s): Maxime Lamothe, Jin L.C. Guo",Hackathon,5.0,2022-05-20T13:00:00,2022-05-20T13:05:00,MSR Main room - odd hours,"Natarajan Chidambaram, Pooya Rostami Mazrae,  DOI,  Pre-print",Talk,Bot Detection in GitHub Repositories,Hackathon
135,2022,Fri 20 May 2022,13:00,13:50,MSR Main room - odd hours,"Chair(s): Maxime Lamothe, Jin L.C. Guo",Hackathon,5.0,2022-05-20T13:05:00,2022-05-20T13:10:00,MSR Main room - odd hours,"Niranjan Hasabnis,  Pre-print,  Media Attached",Talk,GitRank: A Framework to Rank GitHub Repositories,Hackathon
136,2022,Fri 20 May 2022,13:00,13:50,MSR Main room - odd hours,"Chair(s): Maxime Lamothe, Jin L.C. Guo",Hackathon,5.0,2022-05-20T13:10:00,2022-05-20T13:15:00,MSR Main room - odd hours,"Willem Meijer, David Visscher, Erwin de Haan, Merijn Schröder, Leon Visscher, Andrea Capiluppi, Ioan Botez,  Link to publication,  DOI,  Pre-print,  Media Attached",Talk,GrimoireLab Maintenance and Evolution,Hackathon
137,2022,Fri 20 May 2022,13:00,13:50,MSR Main room - odd hours,"Chair(s): Maxime Lamothe, Jin L.C. Guo",Hackathon,5.0,2022-05-20T13:15:00,2022-05-20T13:20:00,MSR Main room - odd hours,"James Walden,  Pre-print",Talk,OpenSSL 3.0.0: An exploratory case study,Hackathon
138,2022,Fri 20 May 2022,13:00,13:50,MSR Main room - odd hours,"Chair(s): Maxime Lamothe, Jin L.C. Guo",Hackathon,5.0,2022-05-20T13:20:00,2022-05-20T13:25:00,MSR Main room - odd hours,"Carlos Gavidia-Calderon, DongGyun Han, Amel Bennaceur,  Pre-print,  Media Attached",Talk,Quid Pro Quo: An Exploration of Reciprocity in Code Review,Hackathon
139,2022,Fri 20 May 2022,13:00,13:50,MSR Main room - odd hours,"Chair(s): Maxime Lamothe, Jin L.C. Guo",Hackathon,5.0,2022-05-20T13:25:00,2022-05-20T13:30:00,MSR Main room - odd hours,"Kalvin Eng, Hareem Sahar,  Pre-print",Talk,Replicating Data Pipelines with GrimoireLab,Hackathon
140,2022,Fri 20 May 2022,13:00,13:50,MSR Main room - odd hours,"Chair(s): Maxime Lamothe, Jin L.C. Guo",Hackathon,20.0,2022-05-20T13:30:00,2022-05-20T13:50:00,MSR Main room - odd hours,,Live Q&A,Discussions and Q&A,Technical Papers
141,2022,Fri 20 May 2022,13:00,13:50,MSR Tutorials room,"Chair(s): Maxime Lamothe, Jin L.C. Guo",Tutorial: Software Bots in Software Engineering: Benefits and Challenges,50.0,2022-05-20T13:00:00,2022-05-20T13:50:00,MSR Tutorials room,"Mairieli Wessel, Marco Gerosa, Emad Shihab",Tutorial,Software Bots in Software Engineering: Benefits and Challenges,Tutorials
